{
  "judge": "restatement",
  "model": "gpt-5",
  "verdict": "block",
  "confidence": 5,
  "reasoning": "All latest-round findings are NEW because the record explicitly says there were no earlier rounds to restate: \"No prior findings yet.\" That means none of the latest findings can satisfy the restatement test, which requires an earlier finding plus an orchestrator response that substantively addressed it. The latest round surfaces multiple distinct failure modes not previously covered, including stale side effects after late transcript repair, stale stalled-model metadata after CAS completion, deprecated percent-complete drift risk, brittle backfill logic for summarize failures, missing composite indexing on a critical query path, inconsistent PAUSED-state reconciliation coverage, unsafe direct completion writes in recovery logic, a summarize-failure livelock loop, and reliance on launch-time totals as a single point of failure. Because 0% of the latest findings are restatements, the loop is still producing signal rather than noise, so the correct decision is to block.",
  "evidence": [
    {
      "artifact": "earlier-rounds",
      "section": "prior-findings",
      "quote": "No prior findings yet."
    },
    {
      "artifact": "spec.codex.edge-cases-adversarial.review.md",
      "section": "high-1",
      "quote": "The late-transcript repair path only reruns `triggerBasicAnalysis(runId)` for a `COMPLETED` run... the spec does not rerun those two side effects after a late transcript is summarized, a run can be published with stale token stats and stale balance accounting forever."
    },
    {
      "artifact": "spec.codex.edge-cases-adversarial.review.md",
      "section": "medium-2",
      "quote": "The proposed CAS SQL drops the existing `stalled_models` reset... completed runs will retain stale stalled-model metadata and any downstream UI or alerting that reads it will be wrong."
    },
    {
      "artifact": "spec.codex.edge-cases-adversarial.review.md",
      "section": "low-3",
      "quote": "`progress.ts` still exposes `calculatePercentComplete(progress)` from the deprecated JSONB counters. If any resolver or UI path keeps calling that helper after cutover, the new derived progress numbers and the displayed percentage will diverge."
    },
    {
      "artifact": "spec.gemini.requirements-adversarial.review.md",
      "section": "high-1",
      "quote": "The proposed data backfill to populate the new `summarizeFailedAt` column relies on a `LIKE 'Summary failed%'` string match against `decisionText`. This is brittle."
    },
    {
      "artifact": "spec.gemini.requirements-adversarial.review.md",
      "section": "high-2",
      "quote": "The provided `schema.prisma` shows separate indexes on `runId` and `status`, but lacks a composite index on `(runId, status)`."
    },
    {
      "artifact": "spec.gemini.requirements-adversarial.review.md",
      "section": "medium-3",
      "quote": "Several other parts of the design described in the spec omit `PAUSED`... a run that becomes stuck while `PAUSED` would not be picked up by the reconciliation sweep."
    },
    {
      "artifact": "spec.gemini.requirements-adversarial.review.md",
      "section": "medium-4",
      "quote": "This file contains logic to directly update a run's status to `COMPLETED` (`data: { status: 'COMPLETED' }`). This is a significant issue because it represents a backdoor that bypasses the entire new system of derived-count checks and atomic CAS updates."
    },
    {
      "artifact": "spec.gemini.requirements-adversarial.review.md",
      "section": "medium-5",
      "quote": "A transcript with `summarizeFailedAt` set would appear \"pending\" to the handler... creating a persistent, useless job-queueing loop and wasting resources."
    },
    {
      "artifact": "spec.gemini.requirements-adversarial.review.md",
      "section": "low-6",
      "quote": "The `RUNNING -> SUMMARIZING` completion logic correctly uses a derived count for `completed` and `failed` probes but continues to trust `Run.progress.total` as the authoritative denominator."
    }
  ],
  "timestamp": "2026-04-23T00:00:00-07:00"
}