{
  "judge": "completeness",
  "model": "gpt-5.4",
  "verdict": "block",
  "confidence": 5,
  "reasoning": "spec.codex.edge-cases-adversarial.review#high-1 is explicitly acknowledged as a limitation in the artifact chain: the plan says the fenced-code-block case is \"pinned as documented limitation with explicit test,\" and the review test note says lines inside fenced code blocks are not excluded; specific enough to implement: yes. spec.codex.feasibility-adversarial.review#high-1 is not addressed: FR-011a only default-fills missing concern fields on read, but there is no named backfill or migration for `id` on existing `unresolved_concerns`, so the run-033 fixture path is still uncovered; specific enough to implement: no. spec.gemini.requirements-adversarial.review#high-3 is not addressed: the chain only expands `_ACTIONABLE_FINDING_RE` and records regex false-positive risk, but it does not name any mitigation for the maintainability/structured-format critique; specific enough to implement: no. Because at least one HIGH remains unaddressed, the verdict is block.",
  "evidence": [
    {
      "artifact": "/Users/chrislaw/valuerank/.claude/worktrees/friendly-aryabhata-9efbf7/docs/workflow/feature-runs/ff-runner-fixes/plan.md",
      "section": "Review Reconciliation",
      "quote": "LOW fenced-code-block regex match \u2014 pinned as documented limitation with explicit test."
    },
    {
      "artifact": "/Users/chrislaw/valuerank/.claude/worktrees/friendly-aryabhata-9efbf7/docs/workflow/feature-runs/ff-runner-fixes/reviews/spec.codex.feasibility-adversarial.review.md.stderr.txt",
      "section": "test_fenced_code_block_with_literal_severity_line_is_documented_limitation",
      "quote": "Known limitation: lines inside fenced code blocks are NOT excluded."
    },
    {
      "artifact": "/Users/chrislaw/valuerank/.claude/worktrees/friendly-aryabhata-9efbf7/docs/workflow/feature-runs/ff-runner-fixes/spec.md",
      "section": "FR-011a",
      "quote": "When older state.json snapshots lack `invariant_warnings` or lack the extended concern fields, the state loader MUST default-fill `invariant_warnings = []` and treat missing concern fields as `None`."
    },
    {
      "artifact": "/Users/chrislaw/valuerank/.claude/worktrees/friendly-aryabhata-9efbf7/docs/workflow/feature-runs/ff-runner-fixes/reviews/spec.codex.feasibility-adversarial.review.md",
      "section": "HIGH finding",
      "quote": "do not backfill `id` for existing `unresolved_concerns`."
    },
    {
      "artifact": "/Users/chrislaw/valuerank/.claude/worktrees/friendly-aryabhata-9efbf7/docs/workflow/feature-runs/ff-runner-fixes/spec.md",
      "section": "FR-006",
      "quote": "`_ACTIONABLE_FINDING_RE` in `factory_review_specs.py` MUST match all of the following shapes, anchored to start-of-line (after optional whitespace):"
    },
    {
      "artifact": "/Users/chrislaw/valuerank/.claude/worktrees/friendly-aryabhata-9efbf7/docs/workflow/feature-runs/ff-runner-fixes/reviews/spec.gemini.requirements-adversarial.review.md",
      "section": "MEDIUM finding",
      "quote": "This creates an \"arms race\" where the tool is always trying to catch up to new, arbitrary markdown formatting choices."
    }
  ],
  "timestamp": "2026-04-24T05:11:21Z"
}