{
  "judge": "restatement",
  "model": "GPT-5.5",
  "verdict": "block",
  "confidence": 5,
  "reasoning": "All latest-round findings are NEW because there were no earlier rounds to restate: the record explicitly says \"No prior findings yet.\" Under the stated rule, a finding can only be a RESTATEMENT if an earlier round raised the same concern and the orchestrator made a substantive change in response. That prerequisite is absent for every item here. Several findings also describe concrete failure modes not previously covered anywhere in the review history: a fenced-code auto-reconcile bypass, missing invariant coverage for mutating commands like discover/parallel/init, missing backfill IDs for existing unresolved concerns, an internal spec contradiction between US1 scenario 3 and FR-004, brittle concern-ID generation, regex-maintenance risk, audit-trail assumptions, ignored contradiction warnings, and lifecycle misuse risk. Some latest findings overlap with each other thematically, but overlap within the same latest batch does not make them restatements of earlier rounds. Because 0% of the latest round can be classified as restatements against prior rounds, the loop is still producing signal and should be blocked from proceeding.",
  "evidence": [
    {
      "artifact": "review-history",
      "section": "earlier-rounds",
      "quote": "No prior findings yet."
    },
    {
      "artifact": "spec.codex.edge-cases-adversarial.review.md",
      "section": "high-1",
      "quote": "The auto-reconcile regex still has a code-fence bypass... a literal `- HIGH:` line inside a fenced code block still matches and is treated as actionable."
    },
    {
      "artifact": "spec.codex.edge-cases-adversarial.review.md",
      "section": "medium-2",
      "quote": "FR-009 under-specifies the state-mutating commands that must get the post-run invariant check... the current runner already treats `discover` and `parallel` as mutating commands... and `init` also writes workflow state during bootstrap."
    },
    {
      "artifact": "spec.codex.feasibility-adversarial.review.md",
      "section": "high-1",
      "quote": "FR-003 and FR-011a do not backfill `id` for existing `unresolved_concerns`... the new lifecycle is unusable on existing runs."
    },
    {
      "artifact": "spec.codex.feasibility-adversarial.review.md",
      "section": "medium-3",
      "quote": "US1 scenario 3 says the next checkpoint can treat concerns as closed when they are \"referenced as `addressed` in plan annotations,\" but FR-004 says annotations are display-only... the spec is internally inconsistent."
    },
    {
      "artifact": "spec.gemini.requirements-adversarial.review.md",
      "section": "medium-1",
      "quote": "Concern ID generation is brittle and may fail to track paraphrased findings [UNVERIFIED]"
    },
    {
      "artifact": "spec.gemini.requirements-adversarial.review.md",
      "section": "high-3",
      "quote": "This method is inherently brittle and adds maintenance complexity... The root problem\u2014a lack of a structured format for review findings\u2014is not addressed."
    }
  ],
  "timestamp": "2026-04-23T00:00:00-07:00"
}